{
  "slug": "ishigaki-old-city-hall-early-construction-request",
  "kind": "advocacy",
  "title": "旧市役所跡地複合施設の早期着工を求める要請",
  "action_date": "2026-03-14",
  "destination_name": "石垣市長",
  "destination_role": "市長",
  "destination_body": "石垣市",
  "description": "令和8年第1回定例会において、旧市役所跡地の複合施設整備が優先交渉権者選定から長期間にわたり着工に至っていない状況を受け、市議会として早期着工と計画の透明性確保を市長に対して求めた。",
  "official_url": null,
  "source_url": null,
  "image_url": null,
  "status": "draft",
  "related_bill_names": [
    "議案第4号 令和5年度石垣市一般会計補正予算（第9号）",
    "議案第11号 令和6年度石垣市一般会計予算",
    "議案第12号 令和7年度石垣市一般会計予算",
    "議案第5号 令和7年度石垣市一般会計補正予算（第12号）"
  ]
}
